<?xml-stylesheet type="text/xsl" href="SimpleEvents.xsl" ?>
<events xmlns:xsi="http://www.w3.org/2001/XMLSchema-instance"
    xsi:noNamespaceSchemaLocation="CalendarXEvents.xsd">
    <event description="PraktXMLT" categories="work" date="2015-05-07" startTime="10:15:00"
        endTime="12:00:00" note="">
        <attendees>
            <attendee description="Anne Br端ggemann-Klein"/>
        </attendees>
        <location description="01.07.023"/>
    </event>
    <event description="VorlEP" categories="work" date="2015-05-04" startTime="12:15:00"
        endTime="13:45:00" note="">
        <attendees>
            <attendee description="Anne Br端ggemann-Klein"/>
        </attendees>
    </event>
    <event description="OChrHFP" categories="music" date="2015-05-08" startTime="20:00:00"
        endTime="22:00:00" note="">
        <attendees>
            <attendee description="Anne Br端ggemann-Klein"/>
            <attendee description="Orchesterleitung"/>
        </attendees>
    </event>
    <event description="OChrHFP" categories="music" date="2015-06-08" startTime="20:00:00"
        endTime="22:00:00" note="">
        <attendees>
            <attendee description="Anne Br端ggemann-Klein"/>
            <attendee description="Orchesterleitung"/>
        </attendees>
    </event>
    <event description="John" categories="lol" date="2015-07-08" startTime="10:15:00"
        endTime="10:15:00" note="Test">
        <attendee description="Test"/>
        <location description="Test"/>
    </event>
    <event description="John" categories="lol" date="2015-07-08" startTime="10:15:00"
        endTime="10:15:00" note="Test">
        <attendee description="Test"/>
        <location description="Test"/>
    </event>
    <event description="John" categories="lol" date="2015-07-08" startTime="10:15:00"
        endTime="10:15:00" note="Test">
        <attendee description="Test"/>
        <location description="Test"/>
    </event>
    <event description="LOOOOL" categories="lol" date="2015-07-08" startTime="10:15:00"
        endTime="10:15:00" note="Test">
        <attendee description="Test"/>
        <location description="Test"/>
    </event>
    <event description="JLOOOL" categories="lol" date="2015-07-08" startTime="10:15:00"
        endTime="10:15:00" note="Test">
        <attendee description="Test"/>
        <location description="Test"/>
    </event>
    <event description="JLOOOL" categories="lol" date="2015-07-08" startTime="10:15:00"
        endTime="10:15:00" note="Test">
        <attendees>
            <attendee description="Test"/>
        </attendees>
        <location description="Test"/>
    </event>
    <event description="dsadas" categories="lol" date="2015-07-08" startTime="10:15:00"
        endTime="10:15:00" note="Test">
        <attendees>
            <attendee description="Test"/>
        </attendees>
        <location description="Test"/>
    </event>
    <event description="" categories="" date="" startTime="" endTime="" note="">
        <attendees/>
        <location description=""/>
    </event>
    <event description="Test1234" categories="Test1234" date="2015-07-21" startTime="10:00:00"
        endTime="10:30:00" note="Test1234">
        <attendees>
            <attendee description="Test1234"/>
        </attendees>
        <location description="Test1234"/>
    </event>
</events>
